{
  "schema_version": 1,
  "template_id": "linuxserver-webtop-debian-xfce",
  "service_family_id": "linuxserver-webtop-debian-xfce",
  "version": "7c4ebdc9-ls209",
  "revision": 1,
  "sort_order": 40,
  "developer_preview": false,
  "disk_bytes": 6442450944,
  "source_url": "https://github.com/linuxserver/docker-webtop",
  "deployment": "container",
  "container_mode": "single",
  "default_access_mode": "unified_proxy",
  "platform_artifacts": {
    "linux-amd64": "lscr.io/linuxserver/webtop:7c4ebdc9-ls209@sha256:686b8fac99918330a7a897ea8ab9e0aeeb822e7b4f5f5aeb837fa984f21d3c2b",
    "linux-arm64": "lscr.io/linuxserver/webtop:7c4ebdc9-ls209@sha256:9092b349d525f765b0be912db1ec5a8d5aa97b0f1a3b57da27a7f72e69c90825"
  },
  "release_discovery": {"source": "oci", "allow_prerelease": false, "allow_non_semver": true},
  "notices": [
    {"id": "interactive-desktop-root-and-network", "revision": 1, "severity": "warning", "acknowledgement_required": true}
  ],
  "icon": {"path": "assets/icon.svg", "media_type": "image/svg+xml"},
  "spec": {
    "schema_version": 3,
    "kind": "container",
    "endpoint": {"scheme": "http", "container_port": 3000, "path": "/", "health_path": "/", "startup_timeout_sec": 180},
    "container": {
      "image": "${REDEVEN_CATALOG_ARTIFACT}",
      "environment": {
        "PUID": "${REDEVEN_RUNTIME_UID}", "PGID": "${REDEVEN_RUNTIME_GID}", "TZ": "${REDEVEN_RUNTIME_TIMEZONE}",
        "TITLE": "Debian XFCE", "START_DOCKER": "false", "FILE_MANAGER_PATH": "/workspace",
        "SELKIES_USE_CPU": "true|locked", "SELKIES_ENABLE_SHARING": "false|locked", "SELKIES_ENABLE_COLLAB": "false|locked",
        "SELKIES_ENABLE_SHARED": "false|locked", "SELKIES_UI_SIDEBAR_SHOW_SHARING": "false|locked"
      },
      "mounts": [
        {"resource_id": "config", "type": "volume", "source": "config", "target": "/config"},
        {"resource_id": "workspace", "type": "workspace", "target": "/workspace"}
      ],
      "read_only_root": false,
      "pids_limit": 2048,
      "runtime_profile": "interactive_desktop"
    }
  }
}
